{
  "$schema": "./authoring-spec.schema.json",
  "version": 3,
  "title": "WorkRail Authoring Rules",
  "purpose": "Canonical current rules for authoring good WorkRail workflows. workflow.schema.json remains the source of truth for legal structure.",
  "lastReviewed": "2026-10-28",
  "principles": [
    "Schema defines what is valid. These rules define what is good.",
    "Prefer current authoring rules over design rationale or historical notes.",
    "Keep prompts user-voiced without losing explicit protocol requirements.",
    "Keep boundary-owned response supplements separate from workflow-authored prompt text."
  ],
  "consumedBy": [
    "docs",
    "tooling",
    "workflow-for-workflows",
    "future-linting"
  ],
  "changeProtocol": [
    "When a workflow feature lands or changes, update the schema and runtime first.",
    "Then update this authoring spec so guidance matches the shipped behavior.",
    "Then regenerate or update human-facing docs and examples derived from this spec.",
    "Do not leave authoring guidance behind the runtime.",
    "Increment `version` when any required-level rule is added, removed, or materially changed. Add a `changelog` entry for the new version."
  ],
  "ruleModel": {
    "levels": [
      "required",
      "recommended",
      "discouraged"
    ],
    "statuses": [
      "active",
      "experimental",
      "planned",
      "deprecated"
    ],
    "enforcementModes": [
      "runtime",
      "validator",
      "ci",
      "advisory",
      "planned"
    ],
    "scopeStyle": "Use small, stable scope strings tied to obvious workflow surfaces."
  },
  "scopeCatalog": [
    {
      "id": "workflow.definition",
      "description": "Whole-workflow authored shape"
    },
    {
      "id": "workflow.description",
      "description": "Top-level workflow description text"
    },
    {
      "id": "workflow.meta-guidance",
      "description": "Workflow-level meta guidance"
    },
    {
      "id": "workflow.extension-points",
      "description": "Workflow-level extension point declarations and binding slots"
    },
    {
      "id": "workflow.features",
      "description": "Compiler feature declarations (closed-set middleware injected at compile time)"
    },
    {
      "id": "step.prompt",
      "description": "Primary step prompt text"
    },
    {
      "id": "step.prompt-fragment",
      "description": "Conditional prompt fragment text"
    },
    {
      "id": "step.prompt-blocks",
      "description": "Structured prompt blocks or shared prompt composition structures"
    },
    {
      "id": "step.output-requirements",
      "description": "Explicit artifact or output requirements in a step"
    },
    {
      "id": "step.context-capture",
      "description": "Explicit context values a step must capture"
    },
    {
      "id": "step.self-audit",
      "description": "A step asking the agent to assess its own understanding or confidence"
    },
    {
      "id": "step.delegation-checkpoint",
      "description": "A step that explicitly fans out to subagents and later synthesizes"
    },
    {
      "id": "step.confirmation",
      "description": "A step that deliberately pauses for human confirmation"
    },
    {
      "id": "loop.step",
      "description": "The loop construct itself"
    },
    {
      "id": "loop.pre-check",
      "description": "Checks done before entering a loop or another pass"
    },
    {
      "id": "loop.decision.prompt",
      "description": "Prompt that decides whether a loop continues or stops"
    },
    {
      "id": "loop.decision",
      "description": "The loop decision checkpoint as a whole"
    },
    {
      "id": "loop.decision.output-example",
      "description": "Example artifact or output shape shown in a loop decision step"
    },
    {
      "id": "workflow.rigor-policy",
      "description": "Rules that differ by QUICK, STANDARD, or THOROUGH rigor"
    },
    {
      "id": "prompt.composition",
      "description": "Prompt assembly strategy including fragments, templates, and shared structure"
    },
    {
      "id": "prompt.templates",
      "description": "Context variable templates and prompt-time substitution"
    },
    {
      "id": "response.supplement",
      "description": "Boundary-owned supplemental instructions delivered alongside a workflow step"
    },
    {
      "id": "synthesis.design",
      "description": "Design synthesis after delegated or external review"
    },
    {
      "id": "synthesis.plan-audit",
      "description": "Plan-audit synthesis after delegated review"
    },
    {
      "id": "synthesis.slice-verification",
      "description": "Slice verification synthesis after delegated review"
    },
    {
      "id": "synthesis.final-verification",
      "description": "Final verification synthesis after delegated review"
    },
    {
      "id": "synthesis.claim-adoption",
      "description": "Rules for adopting or rejecting subagent claims"
    },
    {
      "id": "workflow.authoring",
      "description": "General workflow authoring behavior"
    },
    {
      "id": "tooling.workflow-authoring",
      "description": "Authoring helpers, generation tools, or workflow-for-workflows logic"
    },
    {
      "id": "documentation.authoring",
      "description": "Human-facing authoring documentation"
    },
    {
      "id": "documentation.validation",
      "description": "Validation-focused documentation"
    },
    {
      "id": "validator.implementation",
      "description": "Workflow validator implementation and behavior"
    },
    {
      "id": "ci.validation",
      "description": "CI validation surfaces for workflows"
    },
    {
      "id": "artifact.plan",
      "description": "Implementation-planning artifacts"
    },
    {
      "id": "artifact.spec",
      "description": "Behavior/specification artifacts"
    },
    {
      "id": "artifact.verification",
      "description": "Verification or handoff artifacts"
    },
    {
      "id": "artifact.coordinator-result",
      "description": "wr.coordinator_result artifact emitted by coordinator-phase workflows to signal phase completion to the coordinator"
    },
    {
      "id": "delegation.context-packet",
      "description": "Structured context passed to subagents"
    },
    {
      "id": "delegation.result-envelope",
      "description": "Structured result shape returned by subagents"
    },
    {
      "id": "legacy.patterns",
      "description": "Older authoring patterns that should now be discouraged or avoided"
    },
    {
      "id": "workflow.references",
      "description": "The workflow-level references array declaring external documents surfaced at start time."
    },
    {
      "id": "workflow.assessments",
      "description": "The workflow-level assessments array declaring reusable assessment gate definitions."
    },
    {
      "id": "step.assessment-refs",
      "description": "The step-level assessmentRefs array referencing declared assessment gate definitions."
    },
    {
      "id": "step.assessment-consequences",
      "description": "The step-level assessmentConsequences array declaring blocking consequences when gate dimension levels are met."
    }
  ],
  "topics": [
    {
      "id": "structure",
      "title": "Workflow structure",
      "rules": [
        {
          "id": "schema-is-legal-truth",
          "status": "active",
          "level": "required",
          "scope": [
            "workflow.definition",
            "documentation.authoring",
            "tooling.workflow-authoring"
          ],
          "rule": "Treat workflow.schema.json as the source of truth for legal structure.",
          "why": "A second schema will drift.",
          "enforcement": [
            "advisory"
          ],
          "sourceRefs": [
            {
              "kind": "schema",
              "path": "spec/workflow.schema.json",
              "note": "Legal workflow structure lives here."
            }
          ],
          "checks": [
            "Do not restate field legality unless the point is authoring quality rather than legality.",
            "If this spec mentions a field shape, it should be guidance, not a competing schema."
          ],
          "antiPatterns": [
            "Encoding field legality in multiple docs or specs",
            "Treating prose docs as authoritative over schema"
          ]
        },
        {
          "id": "runtime-behavior-beats-prose",
          "status": "active",
          "level": "required",
          "scope": [
            "documentation.authoring",
            "documentation.validation",
            "tooling.workflow-authoring"
          ],
          "rule": "When docs and runtime behavior disagree, update the docs to match runtime or fix runtime immediately.",
          "why": "Authors need one trustworthy mental model.",
          "enforcement": [
            "advisory"
          ],
          "sourceRefs": [
            {
              "kind": "runtime",
              "path": "src/application/services/validation-engine.ts",
              "note": "Structural authoring invariants enforced by runtime validation."
            },
            {
              "kind": "runtime",
              "path": "src/v2/durable-core/domain/prompt-renderer.ts",
              "note": "Prompt rendering and runtime prompt behavior."
            }
          ],
          "checks": [
            "Compare guidance against validator and renderer behavior before declaring a rule canonical.",
            "Do not leave known mismatches unresolved."
          ],
          "antiPatterns": [
            "Documented behavior that runtime no longer supports",
            "Validator behavior that contradicts authoring guidance without a tracked fix"
          ]
        }
      ]
    },
    {
      "id": "authoring-journey",
      "title": "Authoring journey",
      "rules": [
        {
          "id": "start-from-real-sources",
          "status": "active",